[{"Season":"2024","Player":"Rodri","Nation":"ESP","Age":"27","Squad":"Spain, Manchester City","Pos":"MF"},{"Season":"2023","Player":"Lionel Messi","Nation":"ARG","Age":"35","Squad":"Argentina, Inter Miami, Paris Saint-Germain","Pos":"FW"},{"Season":"2022","Player":"Karim Benzema","Nation":"FRA","Age":"34","Squad":"France, Real Madrid","Pos":"FW"},{"Season":"2021","Player":"Lionel Messi","Nation":"ARG","Age":"33","Squad":"Argentina, Barcelona","Pos":"FW,MF"},{"Season":"2019","Player":"Lionel Messi","Nation":"ARG","Age":"31","Squad":"Argentina, Barcelona","Pos":"FW"},{"Season":"2018","Player":"Luka Modrić","Nation":"CRO","Age":"32","Squad":"Croatia, Real Madrid","Pos":"MF"},{"Season":"2017","Player":"Cristiano Ronaldo","Nation":"POR","Age":"31","Squad":"Portugal, Real Madrid","Pos":"FW"},{"Season":"2016","Player":"Cristiano Ronaldo","Nation":"POR","Age":"30","Squad":"Portugal, Real Madrid","Pos":"FW"},{"Season":"2015","Player":"Lionel Messi","Nation":"ARG","Age":"27","Squad":"Argentina, Barcelona","Pos":"FW,MF"},{"Season":"2014","Player":"Cristiano Ronaldo","Nation":"POR","Age":"28","Squad":"Portugal, Real Madrid","Pos":"FW,MF"},{"Season":"2013","Player":"Cristiano Ronaldo","Nation":"POR","Age":"27","Squad":"Real Madrid","Pos":"FW,MF"},{"Season":"2012","Player":"Lionel Messi","Nation":"ARG","Age":"24","Squad":"Barcelona","Pos":"FW,MF"},{"Season":"2011","Player":"Lionel Messi","Nation":"ARG","Age":"23","Squad":"Barcelona","Pos":"FW,MF"},{"Season":"2010","Player":"Lionel Messi","Nation":"ARG","Age":"22","Squad":"Argentina, Barcelona","Pos":"FW,MF"},{"Season":"2009","Player":"Lionel Messi","Nation":"ARG","Age":"21","Squad":"Barcelona","Pos":"FW,MF"},{"Season":"2008","Player":"Cristiano Ronaldo","Nation":"POR","Age":"22","Squad":"Portugal, Manchester United","Pos":"FW,MF"},{"Season":"2007","Player":"Kaká","Nation":"BRA","Age":"24","Squad":"Milan","Pos":"FW,MF"},{"Season":"2006","Player":"Fabio Cannavaro","Nation":"ITA","Age":"32","Squad":"Italy, Juventus","Pos":"DF"},{"Season":"2005","Player":"Ronaldinho","Nation":"BRA","Age":"24","Squad":"Brazil, Barcelona","Pos":"MF,FW"},{"Season":"2004","Player":"Andriy Shevchenko","Nation":"UKR","Age":"27","Squad":"Milan","Pos":"FW"},{"Season":"2003","Player":"Pavel Nedvěd","Nation":"CZE","Age":"30","Squad":"Juventus","Pos":"MF"},{"Season":"2002","Player":"Ronaldo","Nation":"BRA","Age":"25","Squad":"Brazil, Internazionale","Pos":"FW"},{"Season":"2001","Player":"Michael Owen","Nation":"ENG","Age":"21","Squad":"Liverpool","Pos":"FW"},{"Season":"2000","Player":"Luís Figo","Nation":"POR","Age":"27","Squad":"Portugal,Barcelona","Pos":"FW,MF"},{"Season":"1999","Player":"Rivaldo","Nation":"BRA","Age":"26","Squad":"Barcelona","Pos":"FW,MF"},{"Season":"1998","Player":"Zinédine Zidane","Nation":"FRA","Age":"25","Squad":"France, Juventus","Pos":"MF"},{"Season":"1997","Player":"Ronaldo","Nation":"BRA","Age":"20","Squad":"Barcelona","Pos":"FW"},{"Season":"1996","Player":"Matthias Sammer","Nation":"GER","Age":"28","Squad":"Dortmund","Pos":"DF,MF"},{"Season":"1995","Player":"George Weah","Nation":"LBR","Age":"28","Squad":"Paris Saint-Germain","Pos":"FW"},{"Season":"1994","Player":"Hristo Stoichkov","Nation":"BUL","Age":"27","Squad":"Bulgaria, Barcelona","Pos":"FW,MF"},{"Season":"1993","Player":"Roberto Baggio","Nation":"ITA","Age":"25","Squad":"Juventus","Pos":"FW,MF"},{"Season":"1992","Player":"Marco van Basten","Nation":"NED","Age":"27","Squad":"Milan","Pos":"FW"},{"Season":"1991","Player":"Jean-Pierre Papin","Nation":"FRA","Age":"27","Squad":"Marseille","Pos":"FW"},{"Season":"1990","Player":"LothMatthäus","Nation":"GER","Age":"28","Squad":"Germany, Internazionale","Pos":"DF,MF"},{"Season":"1989","Player":"Marco van Basten","Nation":"NED","Age":"24","Squad":"Milan","Pos":"FW"},{"Season":"1988","Player":"Marco van Basten","Nation":"NED","Age":"23","Squad":"Netherlands, Milan","Pos":"FW"},{"Season":"1987","Player":"Ruud Gullit","Nation":"NED","Age":"24","Squad":"Netherlands, Milan","Pos":"FW,MF"},{"Season":"1986","Player":"Igor Belanov","Nation":"URS","Age":"25","Squad":"Soviet Union","Pos":"FW,MF"},{"Season":"1985","Player":"Michel Platini","Nation":"FRA","Age":"29","Squad":"France, Juventus","Pos":"MF"},{"Season":"1984","Player":"Michel Platini","Nation":"FRA","Age":"28","Squad":"France, Juventus","Pos":"MF"},{"Season":"1983","Player":"Michel Platini","Nation":"FRA","Age":"27","Squad":"France, Juventus","Pos":"MF"},{"Season":"1982","Player":"Paolo Rossi","Nation":"ITA","Age":"25","Squad":"Italy","Pos":"FW"},{"Season":"1981","Player":"Karl-Heinz Rummenigge","Nation":"GER","Age":"25","Squad":"Germany, Bayern Munich","Pos":"FW"},{"Season":"1980","Player":"Karl-Heinz Rummenigge","Nation":"GER","Age":"24","Squad":"Germany, Bayern Munich","Pos":"FW"},{"Season":"1979","Player":"Kevin Keegan","Nation":"ENG","Age":"27","Squad":"England, Hamburg","Pos":"FW"},{"Season":"1978","Player":"Kevin Keegan","Nation":"ENG","Age":"26","Squad":"England, Hamburg","Pos":"FW"},{"Season":"1977","Player":"Allan Simonsen","Nation":"DEN","Age":"24","Squad":"Denmark, Borussia Monchengladbach","Pos":"FW"},{"Season":"1976","Player":"Franz Beckenbauer","Nation":"GER","Age":"30","Squad":"Germany, Bayern Munich","Pos":"DF,MF"},{"Season":"1975","Player":"Oleh Blokhin","Nation":"URS","Age":"22","Squad":"Soviet Union, Dynamo Kyiv","Pos":"FW"},{"Season":"1974","Player":"Johan Cruyff","Nation":"NED","Age":"26","Squad":"Netherlands","Pos":"FW,MF"},{"Season":"1973","Player":"Johan Cruyff","Nation":"NED","Age":"25","Squad":"Netherlands, Ajax","Pos":"FW,MF"},{"Season":"1972","Player":"Franz Beckenbauer","Nation":"GER","Age":"26","Squad":"Germany, Bayern Munich","Pos":"DF,MF"},{"Season":"1971","Player":"Johan Cruyff","Nation":"NED","Age":"23","Squad":"Netherlands, Ajax","Pos":"FW,MF"},{"Season":"1970","Player":"Gerd Müller","Nation":"GER","Age":"24","Squad":"Germany","Pos":"FW"},{"Season":"1969","Player":"Gianni Rivera","Nation":"ITA","Age":"25","Squad":"Italy, Milan","Pos":"FW,MF"},{"Season":"1968","Player":"George Best","Nation":"NIR","Age":"21","Squad":"Northern Ireland, Manchester United","Pos":"FW,MF"},{"Season":"1967","Player":"Flórián Albert","Nation":"HUN","Age":"25","Squad":"Hungary, Ferencvaros","Pos":"FW"},{"Season":"1966","Player":"Bobby Charlton","Nation":"ENG","Age":"28","Squad":"England","Pos":"FW,MF"},{"Season":"1965","Player":"Eusébio","Nation":"POR","Age":"23","Squad":"Portugal, Benfica","Pos":"FW"},{"Season":"1964","Player":"Denis Law","Nation":"SCO","Age":"23","Squad":"Scotland, Manchester United","Pos":"FW"},{"Season":"1963","Player":"Lev Yashin","Nation":"URS","Age":"33","Squad":"Soviet Union, Dynamo Moscow","Pos":"GK"},{"Season":"1962","Player":"Josef Masopust","Nation":"TCH","Age":"30","Squad":"Czechoslovakia","Pos":"MF"},{"Season":"1961","Player":"OmSívori","Nation":"ARG","Age":"25","Squad":"Italy, Juventus","Pos":"FW,MF"},{"Season":"1960","Player":"Luis Suárez","Nation":"ESP","Age":"24","Squad":"Spain, Barcelona","Pos":"MF"},{"Season":"1959","Player":"Alfredo Di Stéfano","Nation":"ARG","Age":"32","Squad":"Spain, Real Madrid","Pos":"FW"},{"Season":"1958","Player":"Raymond Kopa","Nation":"FRA","Age":"26","Squad":"France","Pos":"FW,MF"},{"Season":"1957","Player":"Alfredo Di Stéfano","Nation":"ARG","Age":"30","Squad":"Spain, Real Madrid","Pos":"FW"},{"Season":"1956","Player":"Stanley Matthews","Nation":"ENG","Age":"40","Squad":"England, Blackpool","Pos":"FW,MF"}]