[{"Season":"2024","Player":"Lautaro Martínez","Nation":"ARG","Age":"26","Squad":"Argentina, Internazionale","Pos":"FW"},{"Season":"2023","Player":"Victor Osimhen","Nation":"NGA","Age":"24","Squad":"Nigeria, Napoli","Pos":"FW"},{"Season":"2022","Player":"Rafael Leão","Nation":"POR","Age":"22","Squad":"Portugal, Milan","Pos":"FW"},{"Season":"2021","Player":"Romelu Lukaku","Nation":"BEL","Age":"27","Squad":"Belgium, Chelsea, Internazionale","Pos":"FW"},{"Season":"2020","Player":"Cristiano Ronaldo","Nation":"POR","Age":"34","Squad":"Portugal, Juventus","Pos":"FW"},{"Season":"2019","Player":"Cristiano Ronaldo","Nation":"POR","Age":"33","Squad":"Portugal, Juventus","Pos":"FW"},{"Season":"2018","Player":"Mauro Icardi","Nation":"ARG","Age":"24","Squad":"Argentina, Internazionale","Pos":"FW"},{"Season":"2017","Player":"Gianluigi Buffon","Nation":"ITA","Age":"39","Squad":"Italy, Juventus","Pos":"GK"},{"Season":"2016","Player":"Leonardo Bonucci","Nation":"ITA","Age":"28","Squad":"Italy, Juventus","Pos":"DF"},{"Season":"2015","Player":"Carlos Tevez","Nation":"ARG","Age":"30","Squad":"Argentina, Boca Juniors, Juventus","Pos":"FW,MF"},{"Season":"2014","Player":"Andrea Pirlo","Nation":"ITA","Age":"34","Squad":"Italy, Juventus","Pos":"MF"},{"Season":"2013","Player":"Andrea Pirlo","Nation":"ITA","Age":"33","Squad":"Italy, Juventus","Pos":"MF"},{"Season":"2012","Player":"Zlatan Ibrahimović","Nation":"SWE","Age":"30","Squad":"Sweden, Milan","Pos":"FW"},{"Season":"2011","Player":"Diego Milito","Nation":"ARG","Age":"31","Squad":"Internazionale","Pos":"FW"},{"Season":"2010","Player":"Zlatan Ibrahimović","Nation":"SWE","Age":"28","Squad":"Sweden, Barcelona","Pos":"FW"},{"Season":"2009","Player":"Zlatan Ibrahimović","Nation":"SWE","Age":"27","Squad":"Internazionale","Pos":"FW"},{"Season":"2008","Player":"Kaká","Nation":"BRA","Age":"25","Squad":"Milan","Pos":"FW,MF"},{"Season":"2007","Player":"Fabio Cannavaro","Nation":"ITA","Age":"33","Squad":"Real Madrid","Pos":"DF"},{"Season":"2006","Player":"Alberto Gilardino","Nation":"ITA","Age":"23","Squad":"Italy, Milan","Pos":"FW"},{"Season":"2005","Player":"Kaká","Nation":"BRA","Age":"22","Squad":"Brazil, Milan","Pos":"MF"},{"Season":"2004","Player":"Francesco Totti","Nation":"ITA","Age":"27","Squad":"Italy, Roma","Pos":"FW,MF"},{"Season":"2003","Player":"Pavel Nedvěd","Nation":"CZE","Age":"30","Squad":"Juventus","Pos":"MF"},{"Season":"2002","Player":"David Trezeguet","Nation":"FRA","Age":"24","Squad":"France, Juventus","Pos":"FW"},{"Season":"2001","Player":"Zinédine Zidane","Nation":"FRA","Age":"28","Squad":"Juventus","Pos":"MF"},{"Season":"2000","Player":"Francesco Totti","Nation":"ITA","Age":"23","Squad":"Italy, Roma","Pos":"FW,MF"},{"Season":"1999","Player":"Christian Vieri","Nation":"ITA","Age":"25","Squad":"Lazio","Pos":"FW"},{"Season":"1998","Player":"Ronaldo","Nation":"BRA","Age":"21","Squad":"Brazil, Internazionale","Pos":"FW"},{"Season":"1997","Player":"Roberto Mancini","Nation":"ITA","Age":"32","Squad":"Sampdoria","Pos":"FW"}]