[{"Season":"2024-2025","Player":"Raphinha","Nation":"BRA","Age":"27","Squad":"Barcelona","Pos":"FW,MF"},{"Season":"2023-2024","Player":"JuBellingham","Nation":"ENG","Age":"20","Squad":"Real Madrid","Pos":"MF,FW"},{"Season":"2022-2023","Player":"Marc-André ter Stegen","Nation":"GER","Age":"30","Squad":"Germany, Barcelona","Pos":"GK"},{"Season":"2021-2022","Player":"Karim Benzema","Nation":"FRA","Age":"33","Squad":"Real Madrid","Pos":"FW"},{"Season":"2020-2021","Player":"Jan Oblak","Nation":"SVN","Age":"27","Squad":"Slovenia, Atlético Madrid","Pos":"GK"},{"Season":"2019-2020","Player":"Karim Benzema","Nation":"FRA","Age":"31","Squad":"Real Madrid","Pos":"FW"},{"Season":"2018-2019","Player":"Lionel Messi","Nation":"ARG","Age":"31","Squad":"Barcelona","Pos":"FW"},{"Season":"2017-2018","Player":"Lionel Messi","Nation":"ARG","Age":"30","Squad":"Barcelona","Pos":"FW"},{"Season":"2016-2017","Player":"Lionel Messi","Nation":"ARG","Age":"29","Squad":"Barcelona","Pos":"FW,MF"},{"Season":"2015-2016","Player":"Antoine Griezmann","Nation":"FRA","Age":"24","Squad":"Atlético Madrid","Pos":"FW,MF"},{"Season":"2014-2015","Player":"Lionel Messi","Nation":"ARG","Age":"27","Squad":"Barcelona","Pos":"FW,MF"},{"Season":"2013-2014","Player":"Cristiano Ronaldo","Nation":"POR","Age":"28","Squad":"Real Madrid","Pos":"FW,MF"},{"Season":"2012-2013","Player":"Lionel Messi","Nation":"ARG","Age":"25","Squad":"Barcelona","Pos":"FW,MF"},{"Season":"2011-2012","Player":"Lionel Messi","Nation":"ARG","Age":"24","Squad":"Barcelona","Pos":"FW,MF"},{"Season":"2010-2011","Player":"Lionel Messi","Nation":"ARG","Age":"23","Squad":"Barcelona","Pos":"FW,MF"},{"Season":"2009-2010","Player":"Lionel Messi","Nation":"ARG","Age":"22","Squad":"Barcelona","Pos":"FW,MF"},{"Season":"2008-2009","Player":"Lionel Messi","Nation":"ARG","Age":"21","Squad":"Barcelona","Pos":"FW,MF"}]