[{"Season":"2024","Player":"Ademola Lookman","Nation":"NGA","Age":"26","Squad":"Nigeria, Atalanta","Pos":"FW,MF"},{"Season":"2023","Player":"Victor Osimhen","Nation":"NGA","Age":"24","Squad":"Nigeria, Napoli","Pos":"FW"},{"Season":"2022","Player":"Sadio Mané","Nation":"SEN","Age":"29","Squad":"Senegal, Liverpool","Pos":"MF,FW"},{"Season":"2019","Player":"Sadio Mané","Nation":"SEN","Age":"26","Squad":"Senegal, Liverpool","Pos":"FW"},{"Season":"2018","Player":"Mohamed Salah","Nation":"EGY","Age":"25","Squad":"Egypt, Liverpool","Pos":"FW,MF"},{"Season":"2017","Player":"Mohamed Salah","Nation":"EGY","Age":"24","Squad":"Egypt, Roma","Pos":"FW,MF"},{"Season":"2016","Player":"Riyad Mahrez","Nation":"ALG","Age":"24","Squad":"Leicester City","Pos":"FW,MF"},{"Season":"2015","Player":"Pierre-Emerick Aubameyang","Nation":"GAB","Age":"25","Squad":"Gabon, Dortmund","Pos":"FW,MF"},{"Season":"2015","Player":"Yaya Touré","Nation":"CIV","Age":"31","Squad":"Côte d'Ivoire, Manchester City","Pos":"MF"},{"Season":"2014","Player":"Yaya Touré","Nation":"CIV","Age":"30","Squad":"Côte d'Ivoire, Manchester City","Pos":"MF"},{"Season":"2013","Player":"Yaya Touré","Nation":"CIV","Age":"29","Squad":"Côte d'Ivoire, Manchester City","Pos":"MF"},{"Season":"2012","Player":"Yaya Touré","Nation":"CIV","Age":"28","Squad":"Côte d'Ivoire, Manchester City","Pos":"MF"},{"Season":"2010","Player":"Samuel Eto'o","Nation":"CMR","Age":"28","Squad":"Cameroon, Internazionale","Pos":"FW"},{"Season":"2009","Player":"Didier Drogba","Nation":"CIV","Age":"30","Squad":"Chelsea","Pos":"FW"},{"Season":"2008","Player":"Emmanuel Adebayor","Nation":"TOG","Age":"23","Squad":"Arsenal","Pos":"FW"},{"Season":"2007","Player":"Frédéric Kanouté","Nation":"MLI","Age":"29","Squad":"Sevilla","Pos":"FW"},{"Season":"2006","Player":"Didier Drogba","Nation":"CIV","Age":"27","Squad":"Côte d'Ivoire, Chelsea","Pos":"FW"},{"Season":"2005","Player":"Samuel Eto'o","Nation":"CMR","Age":"23","Squad":"Barcelona","Pos":"FW"},{"Season":"2004","Player":"Samuel Eto'o","Nation":"CMR","Age":"22","Squad":"Mallorca","Pos":"FW"},{"Season":"2003","Player":"Samuel Eto'o","Nation":"CMR","Age":"21","Squad":"Cameroon, Mallorca","Pos":"FW"},{"Season":"2002","Player":"El Hadji Diouf","Nation":"SEN","Age":"21","Squad":"Senegal, Lens","Pos":"FW,MF"},{"Season":"2001","Player":"El Hadji Diouf","Nation":"SEN","Age":"20","Squad":"Lens","Pos":"FW,MF"},{"Season":"2000","Player":"Patrick M'Boma","Nation":"CMR","Age":"29","Squad":"Cagliari","Pos":"FW"},{"Season":"1999","Player":"Nwankwo Kanu","Nation":"NGA","Age":"22","Squad":"Arsenal, Internazionale","Pos":"FW"},{"Season":"1998","Player":"Mustapha Hadji","Nation":"MAR","Age":"26","Squad":"Morocco, SportiCP, Deportivo La Coruña","Pos":"MF"},{"Season":"1997","Player":"Victor Ikpeba","Nation":"NGA","Age":"23","Squad":"Monaco","Pos":"FW"},{"Season":"1996","Player":"Nwankwo Kanu","Nation":"NGA","Age":"19","Squad":"Ajax","Pos":"FW"},{"Season":"1995","Player":"George Weah","Nation":"LBR","Age":"28","Squad":"Paris Saint-Germain","Pos":"FW"},{"Season":"1994","Player":"Emmanuel Amunike","Nation":"NGA","Age":"23","Squad":"Nigeria","Pos":"FW,MF"},{"Season":"1993","Player":"Rashidi Yekini","Nation":"NGA","Age":"29","Squad":"Vitória de Setúbal","Pos":"FW"},{"Season":"1992","Player":"Abedi Pele","Nation":"GHA","Age":"27","Squad":"Marseille","Pos":"FW,MF"},{"Season":"1991","Player":"Abedi Pele","Nation":"GHA","Age":"26","Squad":"Marseille","Pos":"FW,MF"},{"Season":"1990","Player":"Roger Milla","Nation":"CMR","Age":"37","Squad":"Cameroon","Pos":"FW"},{"Season":"1989","Player":"George Weah","Nation":"LBR","Age":"22","Squad":"Monaco","Pos":"FW"},{"Season":"1988","Player":"Kalusha Bwalya","Nation":"ZAM","Age":"24","Squad":"Cercle Brugge","Pos":"FW,MF"},{"Season":"1987","Player":"Rabah Madjer","Nation":"ALG","Age":"28","Squad":"Porto","Pos":"FW"},{"Season":"1986","Player":"Ezzaki Badou","Nation":"MAR","Age":"26","Squad":"Morocco","Pos":"GK"},{"Season":"1985","Player":"Mohamed Timoumi","Nation":"MAR","Age":"25","Squad":"AS FAR","Pos":"FW,MF"},{"Season":"1984","Player":"Théophile Abega","Nation":"CMR","Age":"29","Squad":"Toulouse","Pos":"MF"},{"Season":"1983","Player":"Mahmoud El Khatib","Nation":"EGY","Age":"28","Squad":"Al Ahly","Pos":"FW,MF"},{"Season":"1982","Player":"Thomas N'Kono","Nation":"CMR","Age":"26","Squad":"Cameroon","Pos":"GK"},{"Season":"1981","Player":"Lakhdar Belloumi","Nation":"ALG","Age":"22","Squad":"GC Mascara","Pos":"MF"},{"Season":"1980","Player":"Jean ManOnguéné","Nation":"CMR","Age":"33","Squad":"Canon Yadoundé","Pos":"FW"},{"Season":"1979","Player":"Thomas N'Kono","Nation":"CMR","Age":"23","Squad":"Canon Yadoundé","Pos":"GK"},{"Season":"1978","Player":"Karim Abdul Razak","Nation":"GHA","Age":"21","Squad":"Asante Kotoko","Pos":"MF"},{"Season":"1977","Player":"Tarak Dhiab","Nation":"TUN","Age":"22","Squad":"Espérance Tunis","Pos":"MF"},{"Season":"1976","Player":"Roger Milla","Nation":"CMR","Age":"23","Squad":"Tonnerre Yaoundé","Pos":"FW"},{"Season":"1975","Player":"Ahmed Faras","Nation":"MAR","Age":"29","Squad":"Mohammédia","Pos":"FW,MF"},{"Season":"1974","Player":"Paul Moukila","Nation":"CGO","Age":"23","Squad":"CARA Brazzaville","Pos":"FW,MF"},{"Season":"1973","Player":"BwanTshimen","Nation":"COD","Age":"24","Squad":"TP Mazembe","Pos":"DF,MF"},{"Season":"1972","Player":"Chérif Souleymane","Nation":"GUI","Age":"28","Squad":"Hafia","Pos":"MF"},{"Season":"1971","Player":"Ibrahim Sunday","Nation":"GHA","Age":"26","Squad":"Asante Kotoko","Pos":"MF"},{"Season":"1970","Player":"Salif Keïta","Nation":"MLI","Age":"23","Squad":"Saint-Étienne","Pos":"FW"}]