[{"Season":"2023-2024","Player":"Phil Foden","Nation":"ENG","Age":"23","Squad":"Manchester City","Pos":"FW,MF"},{"Season":"2022-2023","Player":"Erling Haaland","Nation":"NOR","Age":"22","Squad":"Norway, Manchester City","Pos":"FW"},{"Season":"2021-2022","Player":"Kevin De Bruyne","Nation":"BEL","Age":"30","Squad":"Manchester City","Pos":"MF"},{"Season":"2020-2021","Player":"Rúben Dias","Nation":"POR","Age":"23","Squad":"Portugal, Manchester City, Benfica","Pos":"DF"},{"Season":"2019-2020","Player":"Kevin De Bruyne","Nation":"BEL","Age":"28","Squad":"Manchester City","Pos":"MF,FW"},{"Season":"2018-2019","Player":"Virgil van Dijk","Nation":"NED","Age":"27","Squad":"Netherlands, Liverpool","Pos":"DF"},{"Season":"2017-2018","Player":"Mohamed Salah","Nation":"EGY","Age":"25","Squad":"Liverpool","Pos":"FW"},{"Season":"2016-2017","Player":"N'Golo Kanté","Nation":"FRA","Age":"25","Squad":"Chelsea","Pos":"MF"},{"Season":"2015-2016","Player":"Jamie Vardy","Nation":"ENG","Age":"28","Squad":"Leicester City","Pos":"FW"},{"Season":"2014-2015","Player":"Eden Hazard","Nation":"BEL","Age":"23","Squad":"Chelsea","Pos":"FW,MF"},{"Season":"2013-2014","Player":"Luis Suárez","Nation":"URU","Age":"26","Squad":"Liverpool","Pos":"FW"},{"Season":"2012-2013","Player":"Gareth Bale","Nation":"WAL","Age":"23","Squad":"Tottenham Hotspur","Pos":"FW,MF"},{"Season":"2011-2012","Player":"Vincent Kompany","Nation":"BEL","Age":"25","Squad":"Manchester City","Pos":"DF"},{"Season":"2010-2011","Player":"Nemanja Vidić","Nation":"SRB","Age":"28","Squad":"Manchester United","Pos":"DF"},{"Season":"2009-2010","Player":"Wayne Rooney","Nation":"ENG","Age":"23","Squad":"Manchester United","Pos":"FW,MF"},{"Season":"2008-2009","Player":"Nemanja Vidić","Nation":"SRB","Age":"26","Squad":"Manchester United","Pos":"DF"},{"Season":"2007-2008","Player":"Cristiano Ronaldo","Nation":"POR","Age":"22","Squad":"Manchester United","Pos":"FW,MF"},{"Season":"2006-2007","Player":"Cristiano Ronaldo","Nation":"POR","Age":"21","Squad":"Manchester United","Pos":"FW,MF"},{"Season":"2005-2006","Player":"Thierry Henry","Nation":"FRA","Age":"27","Squad":"Arsenal","Pos":"FW"},{"Season":"2004-2005","Player":"Frank Lampard","Nation":"ENG","Age":"26","Squad":"Chelsea","Pos":"MF"},{"Season":"2003-2004","Player":"Thierry Henry","Nation":"FRA","Age":"25","Squad":"Arsenal","Pos":"FW"},{"Season":"2002-2003","Player":"Ruud van Nistelrooy","Nation":"NED","Age":"26","Squad":"Manchester United","Pos":"FW"},{"Season":"2001-2002","Player":"Freddie Ljungberg","Nation":"SWE","Age":"24","Squad":"Arsenal","Pos":"FW,MF"},{"Season":"2000-2001","Player":"Patrick Vieira","Nation":"FRA","Age":"24","Squad":"Arsenal","Pos":"MF"},{"Season":"1999-2000","Player":"Kevin Phillips","Nation":"ENG","Age":"26","Squad":"Sunderland","Pos":"FW"},{"Season":"1998-1999","Player":"Dwight Yorke","Nation":"TRI","Age":"26","Squad":"Aston Villa, Manchester United","Pos":"FW,MF"},{"Season":"1997-1998","Player":"Michael Owen","Nation":"ENG","Age":"17","Squad":"Liverpool","Pos":"FW"},{"Season":"1996-1997","Player":"Juninho Paulista","Nation":"BRA","Age":"23","Squad":"Middlesbrough","Pos":"MF"},{"Season":"1995-1996","Player":"Peter Schmeichel","Nation":"DEN","Age":"31","Squad":"Manchester United","Pos":"GK"},{"Season":"1994-1995","Player":"Alan Shearer","Nation":"ENG","Age":"23","Squad":"Blackburn Rovers","Pos":"FW"}]