[{"Season":"2024-2025","Player":"Ousmane Dembélé","Nation":"FRA","Age":"27","Squad":"France, Paris Saint-Germain","Pos":"MF,FW"},{"Season":"2023-2024","Player":"Kylian Mbappé","Nation":"FRA","Age":"24","Squad":"Paris Saint-Germain","Pos":"FW"},{"Season":"2022-2023","Player":"Kylian Mbappé","Nation":"FRA","Age":"23","Squad":"France, Paris Saint-Germain","Pos":"FW"},{"Season":"2021-2022","Player":"Kylian Mbappé","Nation":"FRA","Age":"22","Squad":"Paris Saint-Germain","Pos":"FW"},{"Season":"2020-2021","Player":"Kylian Mbappé","Nation":"FRA","Age":"21","Squad":"France, Paris Saint-Germain","Pos":"FW"},{"Season":"2018-2019","Player":"Kylian Mbappé","Nation":"FRA","Age":"19","Squad":"France, Paris Saint-Germain","Pos":"MF"},{"Season":"2017-2018","Player":"Neymar","Nation":"BRA","Age":"25","Squad":"Paris Saint-Germain","Pos":"FW"},{"Season":"2016-2017","Player":"Edinson Cavani","Nation":"URU","Age":"29","Squad":"Paris Saint-Germain","Pos":"FW,MF"},{"Season":"2015-2016","Player":"Zlatan Ibrahimović","Nation":"SWE","Age":"33","Squad":"Paris Saint-Germain","Pos":"FW"},{"Season":"2014-2015","Player":"Alexandre Lacazette","Nation":"FRA","Age":"23","Squad":"Lyon","Pos":"FW"},{"Season":"2013-2014","Player":"Zlatan Ibrahimović","Nation":"SWE","Age":"31","Squad":"Paris Saint-Germain","Pos":"FW"},{"Season":"2012-2013","Player":"Zlatan Ibrahimović","Nation":"SWE","Age":"30","Squad":"Paris Saint-Germain","Pos":"FW"},{"Season":"2011-2012","Player":"Eden Hazard","Nation":"BEL","Age":"20","Squad":"Lille","Pos":"FW,MF"},{"Season":"2010-2011","Player":"Eden Hazard","Nation":"BEL","Age":"19","Squad":"Lille","Pos":"FW,MF"},{"Season":"2009-2010","Player":"Lisandro López","Nation":"ARG","Age":"26","Squad":"Lyon","Pos":"FW,MF"},{"Season":"2008-2009","Player":"Yoann Gourcuff","Nation":"FRA","Age":"22","Squad":"Bordeaux","Pos":"MF"},{"Season":"2007-2008","Player":"Karim Benzema","Nation":"FRA","Age":"19","Squad":"Lyon","Pos":"FW"},{"Season":"2006-2007","Player":"Florent Malouda","Nation":"FRA","Age":"26","Squad":"Lyon","Pos":"FW,MF"},{"Season":"2005-2006","Player":"Juninho Pernambucano","Nation":"BRA","Age":"30","Squad":"Lyon","Pos":"MF"},{"Season":"2004-2005","Player":"Michael Essien","Nation":"GHA","Age":"21","Squad":"Lyon","Pos":"DF,MF"},{"Season":"2003-2004","Player":"Didier Drogba","Nation":"CIV","Age":"25","Squad":"Marseille","Pos":"FW"},{"Season":"2002-2003","Player":"Pauleta","Nation":"POR","Age":"29","Squad":"Bordeaux","Pos":"FW"},{"Season":"2001-2002","Player":"Pauleta","Nation":"POR","Age":"28","Squad":"Bordeaux","Pos":"FW"},{"Season":"2000-2001","Player":"Éric Carrière","Nation":"FRA","Age":"27","Squad":"Nantes","Pos":"MF"},{"Season":"1999-2000","Player":"Marcelo Gallardo","Nation":"ARG","Age":"23","Squad":"Monaco","Pos":"MF"},{"Season":"1998-1999","Player":"Ali Benarbia","Nation":"ALG","Age":"29","Squad":"Bordeaux","Pos":"MF"},{"Season":"1997-1998","Player":"Marco Simone","Nation":"ITA","Age":"28","Squad":"Paris Saint-Germain","Pos":"FW,MF"},{"Season":"1996-1997","Player":"Sonny Anderson","Nation":"BRA","Age":"25","Squad":"Monaco","Pos":"FW"},{"Season":"1995-1996","Player":"Zinédine Zidane","Nation":"FRA","Age":"23","Squad":"Bordeaux","Pos":"MF"},{"Season":"1994-1995","Player":"Vincent Guérin","Nation":"FRA","Age":"28","Squad":"Paris Saint-Germain","Pos":"MF"},{"Season":"1993-1994","Player":"David Ginola","Nation":"FRA","Age":"26","Squad":"France, Paris Saint-Germain","Pos":"FW,MF"}]